{
  "title": "API 管理的服务级别协议",
  "slug": "api-management",
  "metaTitle": "API 管理的服务级别协议 | Azure",
  "metaDescription": "API 管理的服务级别协议",
  "metaKeywords": "",
  "pageType": "SLA",
  "lastModifiedDate": "2018年5月",
  "articleDescription": "<p>我们保证在不少于 99.9% 的时间内基本、标准和高级层级中运行的 API 管理服务实例可以响应执行操作的请求。</p><p>为 API 管理服务的开发人员层级未提供任何服务级别协议。</p>",
  "mainContent": "<h2>引言</h2><p>本 Azure 服务级别协议（以下简称“服务级别协议”）由世纪互联制定，与客户从世纪互联处购买 Azure 服务所依据的协议（以下简称“协议”）相关并构成该协议的一部分。</p><p>为了保证达到并保持所提供服务的服务级别，我们会提供财务方面的支持。如果我们未能达到和保持本服务级别协议中说明的每种服务的服务级别，则您有资格获得月度服务费用的部分服务费抵扣。在您的协议期间，这些条款都不会做任何变动。如果续展订购，则在续订期限开始时实行的本服务级别协议的版本将适用于整个续订期限。如果对本服务级别协议有任何重大不利变更，我们应至少提前九十 (90) 天进行通知。您可以随时访问 <a href=\"../../legal/sla/index.html\" id=\"api-management-sla_sla\">https://www.azure.cn/support/legal/sla/</a>查看本服务级别协议的最新版本。</p><h2>一般条款</h2><h3>一、定义</h3><ol><li><p>“索赔” 指客户根据本服务级别协议向世纪互联提交的、有关尚未达到某个服务级别以及客户可获得的服务费抵扣的索赔。</p></li><li><p>“客户”指签订本协议的机构。</p></li><li><p>“客户支持”指世纪互联可由此为客户提供帮助以解决服务问题的服务。</p></li><li><p>“错误代码”用于指示某项操作出现了问题，例如，5xx 范围内的 HTTP 状态代码。</p></li><li><p>“外部连接”是指可通过受支持的协议（例如 HTTP 和 HTTPS）从公共 IP 地址发送和接收的双向网络流量。</p></li><li><p>“事件”表示导致无法达到服务级别的任何情况。</p></li><li><p>“管理门户”指由世纪互联提供的 web 界面，客户可以通过该界面来管理服务。</p></li><li><p>“世纪互联”指客户协议上载明的世纪互联实体。</p></li><li><p>“预览版”指提供用来获得客户反馈的服务或软件的预览版、测试版或其他预发行版。</p></li><li><p>“服务”表示根据协议为客户提供的并在以下指定服务级别协议的 Azure 服务。</p></li><li><p>“服务费抵扣”表示针对受影响的服务或服务资源的已经证实的服务索赔，返还给客户的月度服务费用的百分比。</p></li><li><p>“服务级别”指定世纪互联选择遵守并据此衡量其所提供的每种服务的服务级别的标准，具体如下所述。</p></li><li><p>“服务资源”指某个服务内可供使用的单独资源。</p></li><li><p>“成功代码”用于指示某项操作已经成功，例如，2xx 范围内的 HTTP 状态代码。</p></li><li><p>“支持时段”指支持某个服务功能或者支持与某个单独产品或服务兼容的时间范围。</p></li><li><p>“虚拟网络”指虚拟专用网络，包括用户定义的 IP 地址和子网的集合，形成了 Azure 内的网络边界。</p></li><li><p>“虚拟网络网关”是指促成虚拟网络和客户本地网络之间跨区域连接的网关。</p></li></ol><h3>二、服务费抵扣索赔</h3><ol><li><p>客户必须在事件（索赔主题）发生的帐单月份结束之后的两 (2) 个月内向客户支持提交索赔，世纪互联才会受理该索赔。客户必须向客户支持提供世纪互联证实该索赔所需的所有信息，包括但不限于：事件的详细说明、事件的发生时间和持续时间、受影响的资源或操作以及客户尝试解决该事件所做出的任何努力。</p></li><li><p>世纪互联将利用所有可合理获得的信息来验证索赔，并判定是否应兑现服务费抵扣。</p></li><li><p>如果由于同一事件导致未能达到某个特定服务的多个服务级别，客户必须仅选择一个服务级别并基于该服务级别针对此次事件提出索赔。</p></li><li><p>服务费抵扣仅适用于为未达到服务级别的特定服务、服务资源或服务层级所支付的费用。如果服务级别适用于单独的服务资源或单独的服务层级，则服务费抵扣仅适用于为受影响的服务资源或服务层级（如果有）所支付的费用。</p></li></ol><h3>三、服务级别协议排除项</h3><p>本服务级别协议和任何适用的服务级别不适用于由以下情况造成的任何性能或可用性问题：</p><ol><li><p>由于超出世纪互联合理控制范围的因素而导致的问题，例如，在世纪互联数据中心以外（包括在客户的站点或者客户的站点和世纪互联数据中心之间）的网络或设备故障；</p></li><li><p>由于客户使用非世纪互联提供的硬件、软件或服务（例如，从 Azure 商店购买的第三方软件或服务或者世纪互联提供的其他非 Azure 服务）作为服务的一部分而导致的问题；</p></li><li><p>由于客户未按与服务功能一致的方式（例如，尝试执行不受支持的操作）或者未按与发布的文档或指南一致的方式来使用服务而导致的问题；</p></li><li><p>由于错误的输入、指令或参数（例如，请求访问不存在的文件）而导致的问题；</p></li><li><p>世纪互联建议客户改变服务的使用方式之后，如果客户未按建议改变其使用方式而继续使用服务所导致的问题；</p></li><li><p>使用预览版期间出现问题或者与预览版有关的问题，或者使用世纪互联订购信用进行购买而导致的问题；</p></li><li><p>由于客户试图执行的操作超出了规定的服务配额而导致的问题，或者由于限制可疑的滥用行为而导致的问题；</p></li><li><p>由于客户使用的服务功能超出了相关支持时段而导致的问题；或</p></li><li><p>由于他人利用客户的密码或设备未经授权地访问世纪互联服务的行为，或由于客户未能遵循适当的安全惯例而导致的问题。</p></li></ol><h3>四、服务费抵扣</h3><ol><li><p>针对所描述的每一种服务，下文介绍了服务费抵扣的金额和计算方法。</p></li><li><p>服务费抵扣是客户针对未能达到任何服务级别的唯一且排他性的救济。</p></li><li><p>在任何情况下，任何帐单月份内提供的与特定服务或服务资源相关的服务费抵扣都不得超过客户在该帐单月份内用于该服务或服务资源（如果有）的月度服务费用。</p></li><li><p>对于作为套件一部分购买的服务，服务费抵扣将基于服务所占的成本比例进行计算，这将由世纪互联通过合理的判断确定。如果客户已从转售商处购买服务，服务费抵扣将基于适用服务的估计零售价进行计算，这将由世纪互联通过合理的判断确定。</p></li></ol><h2>SLA 详细信息</h2><ol><li><p>“<strong>部署分钟数</strong>”是指在一个帐单月份期间在 Azure 中部署指定 API 管理实例的总分钟数。</p></li><li><p>“<strong>最大可用分钟数</strong>”是指在一个帐单月份期间，指定的 Azure 订购中部署的所有 API 管理实例的总部署分钟数。</p></li><li><p>“<strong>代理</strong>”是指负责接收 API 请求并将其转发给配置的相关 API 的 API 管理服务组件。</p></li><li><p>“<strong>停机时间</strong>”是指 API 管理服务不可用期间，最大可用分钟的分钟总数。如果在某一分钟内所有通过代理不断尝试执行的操作均导致错误代码，或者在五分钟内没有返回成功代码，则可以视为在该分钟内指定的 API 管理实例不可用。</p><li><p>“<strong>每月正常服务时间百分比</strong>”是用最大可用分钟减去停机时间，再除以最大可用分钟乘以 100 计算</p><pre><code>每月正常服务时间百分比 % = (最大可用分钟数 − 停机时间) / 最大可用分钟数 X 100;<br/></code></pre></li></li></ol><h3>用于在单一区域内扩展的消费层级、基本层级、标准层级和高级层级部署的服务额度：</h3><table><thead><tr><th>正常服务时间百分比</th><th>服务额度</th></tr></thead><tbody><tr><td>&lt;99.95%</td><td>10%</td></tr><tr><td>&lt;99%</td><td>25%</td></tr></tbody></table><h3>用于跨两个或两个以上区域扩展的高级层级部署的服务额度：</h3><table><thead><tr><th>正常服务时间百分比</th><th>服务额度</th></tr></thead><tbody><tr><td>&lt;99.99%</td><td>10%</td></tr><tr><td>&lt;99%</td><td>25%</td></tr></tbody></table>"
}
