{
  "title": "SLA for Azure Databricks",
  "slug": "databricks",
  "metaTitle": "SLA for Azure Databricks",
  "metaDescription": "SLA for Azure Active Directory Domain Services",
  "metaKeywords": "",
  "pageType": "SLA",
  "lastModifiedDate": "09/21/2020",
  "articleDescription": "<p>We guarantee that Azure Databricks will be available 99.95% of the time.</p>",
  "mainContent": "<h2>Introduction</h2><p>This Service Level Agreement for 21Vianet Online Services (this “SLA”) is a part of your 21Vianet volume licensing agreement (the “Agreement”). Capitalized terms used but not defined in this SLA will have the meaning assigned to them in the Agreement. This SLA applies to the 21Vianet Online Services listed herein (a “Service” or the “Services”), but does not apply to separately branded services made available with or connected to the Services or to any on-premises 21Vianet that is part of any Service.</p><p>If we do not achieve and maintain the Service Levels for each Service as described in this SLA, then you may be eligible for a credit towards a portion of your monthly service fees. We will not modify the terms of your SLA during the initial term of your subscription; however, if you renew your subscription, the version of this SLA that is current at the time of renewal will apply throughout your renewal term. We will provide at least 90 days’ notice for adverse material changes to this SLA.</p><h2>General Terms</h2><h3>1. Definitions</h3><ol><li><p>\"Claim\" means a claim submitted by Customer to 21Vianet pursuant to this SLA that a Service Level has not been met and that a Service Credit may be due to Customer. </p></li><li><p>\"Customer\" refers to the organization that has entered into the Agreement. </p></li><li><p>\"Customer Support\" means the services by which 21Vianet may provide assistance to Customer to resolve issues with the Services.</p></li><li><p>\"Error Code\" means an indication that an operation has failed, such as an HTTP status code in the 5xx range.</p></li><li><p>\"External Connectivity\" is bi-directional network traffic over supported protocols such as HTTP and HTTPS that can be sent and received from a public IP address.</p></li><li><p>\"Incident\" means any set of circumstances resulting in a failure to meet a Service Level.</p></li><li><p>\"Management Portal\" means the web interface, provided by 21Vianet, through which customers may manage the Service.</p></li><li><p>\"21Vianet\" means the 21Vianet entity that appears on Customer's Agreement. </p></li><li><p>\"Preview\" refers to a preview, beta, or other pre-release version of a service or software offered to obtain customer feedback.</p></li><li><p>\"Service” or “Services\" refers to a Azure service provided to Customer pursuant to the Agreement for which an SLA is provided below.</p></li><li><p>\"Service Credit\" is the percentage of the monthly service fees for the affected Service or Service Resource that is credited to Customer for a validated Claim.</p></li><li><p>\"Service Level\" means standards 21Vianet chooses to adhere to and by which it measures the level of service it provides for each Service as specifically set forth below.</p></li><li><p>\"Service Resource\" means an individual resource available for use within a Service.</p></li><li><p>\"Success Code\" means an indication that an operation has succeeded, such as an HTTP status code in the 2xx range.</p></li><li><p>\"Support Window\" refers to the period of time during which a Service feature or compatibility with a separate product or service is supported. </p></li><li><p>\"Virtual Network\" refers to a virtual private network that includes a collection of user-defined IP addresses and subnets that form a network boundary within Azure.</p></li><li><p>\"Virtual Network Gateway\" refers to a gateway that facilitates cross-premises connectivity between a Virtual Network and a customer on-premises network.</p></li></ol><h3>2. Service Credit Claims</h3><ol><li><p>In order for 21Vianet to consider a Claim, Customer must submit the Claim to Customer Support within two months of the end of the billing month in which the Incident that is the subject of the Claim occurs. Customer must provide to Customer Support all information necessary for 21Vianet to validate the Claim, including but not limited to detailed descriptions of the Incident, the time and duration of the Incident, the affected resources or operations, and any attempts made by Customer to resolve the Incident</p></li><li><p>21Vianet will use all information reasonably available to it to validate the Claim and to determine whether any Service Credits are due.</p></li><li><p>In the event that more than one Service Level for a particular Service is not met because of the same Incident, Customer must choose only one Service Level under which a Claim may be made based on the Incident.</p></li><li><p>Service Credits apply only to fees paid for the particular Service, Service Resource, or Service tier for which a Service Level has not been met. In cases where Service Levels apply to individual Service Resources or to separate Service tiers, Service Credits apply only to fees paid for the affected Service Resource or Service tier, as applicable.</p></li></ol><h3>3. SLA Exclusions</h3><p>This SLA and any applicable Service Levels do not apply to any performance or availability issues:</p><ol><li><p>Due to factors outside 21Vianet’s reasonable control (for example, a network or device failure external to 21Vianet’s data centers, including at Customer's site or between Customer's site and 21Vianet’s data center);</p></li><li><p>That resulted from Customer's use of hardware, software, or services not provided by 21Vianet as part of the Services (for example, third-party software or services purchased from the Azure Store or other non-Azure services provided by 21Vianet); </p></li><li><p>Due to Customer's use of the Service in a manner inconsistent with the features and functionality of the Service (for example, attempts to perform operations that are not supported) or inconsistent with published documentation or guidance;</p></li><li><p>That resulted from faulty input, instructions, or arguments (for example, requests to access files that do not exist);</p></li><li><p>Caused by Customer's use of the Service after 21Vianet advised Customer to modify its use of the Service, if Customer did not modify its use as advised;</p></li><li><p>During or with respect to Previews or to purchases made using 21Vianet subscription credits;</p></li><li><p>That resulted from Customer's attempts to perform operations that exceed prescribed quotas or that resulted from throttling of suspected abusive behavior;</p></li><li><p>Due to Customer's use Service features that are outside of associated Support Windows; or</p></li><li><p>Attributable to acts by persons gaining unauthorized access to 21Vianet’s Service by means of Customer's passwords or equipment or otherwise resulting from Customer's failure to follow appropriate security practices.</p></li></ol><h3>4. Service Credits</h3><ol><li><p>The amount and method of calculation of Service Credits is described below in connection with each Service. </p></li><li><p>Service Credits are Customer's sole and exclusive remedy for any failure to meet any Service Level.</p></li><li><p>The Service Credits awarded in any billing month for a particular Service or Service Resource will not, under any circumstance, exceed Customer's monthly service fees that Service or Service Resource, as applicable, in the billing month.</p></li><li><p>For Services purchased as part of a suite, the Service Credit will be based on the pro-rata portion of the cost of the Service, as determined by 21Vianet in its reasonable discretion. In cases where Customer has purchased Services from a reseller, the Service Credit will be based on the estimated retail price for the applicable Service, as determined by 21Vianet in its reasonable discretion.</p></li></ol><h2>SLA details </h2><h4>Additional Definitions</h4><p>\"<strong>Azure Databricks Gateway</strong>\" is a set of compute resources that proxy UI and API requests between Customer and Azure Databricks.</p><h4>Monthly Uptime Calculation and Service Levels for Azure Databricks</h4><p>\"<strong>Maximum Available Minutes</strong>\" is the total number of minutes across all Azure Databricks workspaces deployed by Customer in a given Microsoft Azure subscription in a billing month.</p><p>\"<strong>Downtime</strong>\" is the total accumulated minutes of unavailability across all Azure Databricks workspaces deployed in a given Microsoft Azure subscription. A minute is considered unavailable for a given Azure Databricks workspace if all continual attempts within the minute to establish a connection to the Azure Databricks Gateway for the applicable workspace fail.</p><p>\"<strong>Monthly Uptime Percentage</strong>\" for the Azure Databricks Service is calculated as Maximum Available Minutes less Downtime divided by Maximum Available Minutes multiplied by 100. Monthly Uptime Percentage is represented by the following formula:</p><pre><code> Monthly Uptime % = (Maximum Available Minutes - Downtime) / Maximum Available Minutes * 100<br/></code></pre><p>The following Service Levels and Service Credit are applicable to Customer's use of Azure Databricks</p><table cellpadding=\"0\" cellspacing=\"0\" width=\"100%\"><thead><tr><th align=\"left\"> MONTHLY UPTIME PERCENTAGE</th><th align=\"left\"> SERVICE CREDIT</th></tr></thead><tbody><tr><td>&lt;99.9%</td><td>10%</td></tr><tr><td>&lt;99%</td><td>25%</td></tr></tbody></table>"
}
