{
  "title": "公安备案",
  "slug": "public-security-registration",
  "metaTitle": "公安备案操作流程 - Azure云计算",
  "metaDescription": "公安备案由国务院批准发布的《计算机信息网络国际联网安全保护管理办法》（公安部第 33 号令）中规定：第十一条 用户在接入单位办理入网手续时，应当填写用户备案表。备案表由公安部监制。",
  "metaKeywords": "公安备案操作流程",
  "pageType": "PSR",
  "lastModifiedDate": "2023年12月",
  "articleDescription": "",
  "mainContent": "<h2>为什么要备案</h2><p>由国务院批准发布的《计算机信息网络国际联网安全保护管理办法》（公安部第 33 号令）中规定：\r\n                        \n\r\n                        第十一条 用户在接入单位办理入网手续时，应当填写用户备案表。备案表由公安部监制。\r\n                        \n\r\n                        第十二条 互联单位、接入单位、使用计算机信息网络国际联网的法人和其他组织（包括跨省、自治区、直辖市联网的单位和所属的分支机构），应当自网络正式联通之日起三十日内，到所在地的省、自治区、直辖市人民政府公安机关指定的受理机关办理备案手续。\r\n                        \n\r\n                        前款所列单位应当负责将接入本网络的接入单位和用户情况报当地公安机关备案，并及时报告本网络中接入单位和用户的变更情况。</p><h2>如何备案</h2><p>请登录<a href=\"https://beian.mps.gov.cn/\" id=\"icp_beian\">全国互联网安全管理服务平台</a>，按照网站的指引完成备案操作。</p>"
}
